1748,BaoHoLaoDong,CTCP Tạp phẩm và Bảo hộ Lao động,,OTC,0
1749,BaoVietBank,Ngân hàng TMCP Bảo Việt,Tổ chức tín dụng,OTC,"300,000,000"
1750,BaoVietResort,CTCP Khách Sạn và Du Lịch Bảo Việt,,OTC,0
1751,Barotex,CTCP Thương mại và Đầu tư Barotex Việt Nam,,OTC,"65,200,000"
1752,BAS,CTCP Basa,"Thực phẩm, đồ uống và thuốc lá",OTC,"9,600,000"
1753,Baseafood,CTCP Chế biến Xuất nhập khẩu Thủy sản Bà Rịa - Vũng Tàu,,OTC,"4,800,000"
1754,BatDongsanIP,CTCP Đầu tư Bất động sản I.P,,Khác,0
1755,BAV,CTCP Hàng không Tre Việt,,OTC,0
1756,BBCC,Công ty TNHH MTV Đầu tư và Phát triển BB,,Khác,0
1757,BBL,CTCP Bourbon Bến Lức,,OTC,0
1758,BBPC,CTCP BB Power Holdings,,Khác,0
1759,BCEL,Ngân hàng Ngoại Thương Lào,Tổ chức tín dụng,Lào,"136,577,600"
1760,BCEL-KT,BCEL-KT Securities Co. LTD,Dịch vụ tài chính,Khác,0
1761,BCI,Công ty TNHH MTV Đầu tư Kinh doanh Nhà Khang Phúc,Bất động sản,Khác,"86,720,144"
1762,BCMC,CTCP Phát triển Hạ tầng Kỹ thuật Becamex-Bình Phước,,Khác,0
1763,BCO,CTCP Xây dựng Bình Phước,Nguyên vật liệu,OTC,"5,631,895"
1764,BDC,Tổng Công ty Xây dựng Bạch Đằng - CTCP,Hàng hóa công nghiệp,OTC,"21,735,900"
1765,BDF,CTCP Giày Bình Định,Thời trang và hàng lâu bền,OTC,"1,550,000"
1766,BDIC,CTCP Đầu tư và Phát triển Bình Định,,Khác,0
1767,BDMienTrung,CTCP Xây lắp Bưu điện Miền Trung,,OTC,0
1768,BDOAudit,Công ty TNHH Kiểm toán BDO,,Khác,0
1769,BDP,CTCP Biệt thự và Khách sạn biển Đông Phương,Bất động sản,OTC,"25,000,000"
1770,BDS,CTCP Đường Bình Định,"Thực phẩm, đồ uống và thuốc lá",OTC,"3,400,000"
1771,BDSC,CTCP BDS,,Khác,0
1772,BDSDKVN,CTCP Bất động sản Dầu khí Việt Nam,,OTC,0
1773,BDSThanhNien,CTCP Bất động sản Thanh Niên,,OTC,0
1774,BecamexCMC,CTCP Vật liệu Xây dựng Becamex,,OTC,0
1775,BenhVienGiaoThong,CTCP Bệnh viện Giao thông Vận tải,,OTC,0
1776,BenThanhG,Tổng Công ty Bến Thành,,OTC,0
1777,Benthanhhouse,CTCP Phát triển và Dịch vụ Nhà Bến Thành,,OTC,0
1778,Beta,CTCP Chứng khoán Beta,Dịch vụ tài chính,OTC,"40,000,000"
1779,BeTongHaiAu,CTCP Bê tông Hải Âu,,OTC,0
1780,BGDC,CTCP Phát triển Đầu Tư - Xây dựng Bách Giang - DCI,,Khác,0
1781,BGIC,Công ty TNHH Đầu tư Big Gain,,Khác,0
1782,BGM,CTCP Khai Thác và Chế Biến khoáng Sản Bắc Giang,Nguyên vật liệu,OTC,"45,753,840"
1783,BHAAC,Công ty TNHH Kiểm toán và Kế toán Biên Hoà,Dịch vụ thương mại và chuyên nghiệp,Khác,0
1784,BHBC,CTCP Năng lượng Bắc Hà,,Khác,0
1785,BHCC,CTCP Bình Hiệp,,Khác,0
1786,BHDienMay,CTCP Bách hóa Điện máy Sài Gòn,,OTC,0
1787,BHGC,CTCP Đầu tư và Phát triển golf Bình Hải,,Khác,0
1788,BHS,Công ty TNHH MTV Đường TTC Biên Hòa - Đồng Nai,"Thực phẩm, đồ uống và thuốc lá",Khác,"297,874,449"
1789,BHSC,CTCP Hàng tiêu dùng Biên Hòa,,Khác,0
1790,BHT,CTCP Đầu tư Xây dựng Bạch Đằng TMC,Hàng hóa công nghiệp,OTC,"4,565,000"
1791,BHV,CTCP Bá Hiến,Nguyên vật liệu,OTC,"972,013"
1792,BHVC,CTCP Bách Hưng Vương,,Khác,0
1793,BHYC,Công ty TNHH Dịch vụ và Phát triển Bất động sản BHYT,,Khác,0
1794,BIAC,CTCP Đầu Tư và Phát triển Bất động sản Bình An,,Khác,0
1795,BiaCanTho,CTCP Bia Nước giải khát Cần Thơ,,OTC,"2,390,000"
1796,BiaSaiGonDongNai,CTCP Bia Sài Gòn - Đồng Nai,,OTC,0
1797,BiaSaiGonHaNam,CTCP Bia Sài Gòn - Hà Nam,,OTC,0
1798,BiaSaiGonPhuYen,CTCP Bia Sài Gòn - Phú Yên,,OTC,"6,000,000"
1799,BiaSaiGonQuyNhon,CTCP Bia Sài Gòn - Quy Nhơn,,OTC,0
1800,BiaVietHa,CTCP Bia và Nước giải khát Việt Hà,,OTC,0
1801,BIDC,CTCP BIDGroup,,Khác,0
1802,BIDVMetlife,Công ty TNHH Bảo hiểm nhân thọ BIDV Metlife,Bảo hiểm,Khác,0
1803,BIMC,CTCP Bất động sản BIM,,Khác,0
1804,BinhAnSeaFood,CTCP Thủy sản Bình An,,OTC,"50,000,000"
1805,BinhDien,CTCP Thủy điện Bình Điền,,OTC,0
1806,BinhDinh,CTCP Vật tư Kỹ thuật Nông nghiệp Bình Định,,OTC,0
1807,BinhTriThien,CTCP Lương thực Bình Trị Thiên,,OTC,0
1808,Biprica,CTCP In và Bao bì Bình Định,,OTC,0
1809,BISS,CTCP Chứng khoán BIS,Dịch vụ tài chính,OTC,"4,000,000"
1810,BITC,CTCP Kinh doanh và Đầu Tư Bình Dương,,Khác,0
1811,BIZC,CTCP Khu công nghiệp Thành Thành Công,,Khác,0
1812,BJC,CTCP VRG - Bảo Lộc,,OTC,0
1813,BJCC,CTCP Đầu Tư Thương Mại Bright Jupiter,,Khác,0
1814,BKH,CTCP Bánh mứt kẹo Hà Nội,"Thực phẩm, đồ uống và thuốc lá",OTC,"1,750,000"
1815,BKPC,CTCP Phần mềm diệt virus Bkav,,Khác,0
1816,BLU,Trung tâm Dịch vụ Đô thị tỉnh Bạc Liêu,Dịch vụ thương mại và chuyên nghiệp,OTC,"1,337,600"
1817,Bluechipfund,Quỹ đầu tư Cổ phiếu Hàng đầu VCBF,Dịch vụ tài chính,OTC,0
1818,BLW,CTCP Cấp nước Bạc Liêu,Tiện ích,OTC,"11,168,800"
1819,BM9,CTCP Đầu tư Xây dựng 319 Miền Nam,Thương mại hàng không thiết yếu,OTC,"3,795,680"
1820,BMJC,CTCP Xây dựng và Sản xuất Vật liệu Xây dựng,,OTC,0
1821,BMN,CTCP 715,Hàng hóa công nghiệp,OTC,"2,750,000"
1822,BNC,CTCP Dịch vụ Cáp treo Bà Nà,,OTC,"216,400,000"
1823,BNPC,CTCP Bất động sản BNP Global,,Khác,0
1824,BongSen,CTCP Bông Sen,,OTC,"32,663,788"
1825,BOOC,CTCP B.O.O Nước Thủ Đức,,Khác,0
1826,BOT741,CTCP Kinh doanh BOT đường ĐT.741,,Khác,0
1827,BOTRM,Công ty TNHH B.O.T Cầu Rạch Miễu,,Khác,0
1828,BPCC,CTCP Năng lượng Bitexco,,Khác,0
1829,BPEC,CTCP Năng lượng Bắc Phương,,Khác,0
1830,BPGC,CTCP Điện gió Bắc Phương,,Khác,0
1831,BPMC,CTCP Vật tư Xăng dầu Bình Thuận,,OTC,0
1832,BPW,CTCP Cấp thoát nước Bình Phước,Tiện ích,OTC,"13,203,858"
1833,Britec,CTCP Tư vấn Thiết kế Cầu Lớn - Hầm,,OTC,0
1834,BSMCorp,CTCP Phần mềm Giải pháp Quản lý Mã vạch,,OTC,0
1835,BSPC,CTCP BB Sunrise Power,,Khác,0
1836,BTC,CTCP Cơ khí và Xây dựng Bình Triệu,Hàng hóa công nghiệp,OTC,"30,000,000"
1837,BTCC,CTCP Tân Hoàn Cầu Bến Tre,,Khác,0
1838,BTCom,CTCP Đầu tư Thương mại Bến Thành,,OTC,0
1839,BTIC,CTCP Đầu Tư Thương Mại Bình Tân,,Khác,0
1840,BTJ,CTCP Vàng bạc Đá quý Bến Thành,,OTC,0
1841,BTL,CTCP Tập đoàn Capella,,OTC,"13,625,400"
1842,BTR,CTCP Đường sắt Bình Trị Thiên,Vận tải,OTC,"1,850,000"
1843,BTWASECO,CTCP Cấp thoát nước Bình Thuận,,OTC,0
1844,BUD,CTCP Khoa học Công nghệ Việt Nam,Dịch vụ thương mại và chuyên nghiệp,OTC,"10,000,000"
1845,BuuDienCM,CTCP Xây lắp và Dịch vụ Bưu điện Cà Mau,,OTC,0
1846,BVA,CTCP Sản xuất và Thương mại Bắc Việt,,OTC,0
1847,BVBC,CTCP BVB,,Khác,0
1848,BVC,CTCP Nhựa Bảo Vân,,OTC,"24,000,000"
1849,BVF1,Quỹ đầu tư Chứng khoán Bảo Việt,Dịch vụ tài chính,Khác,0
1850,BVFED,Quỹ đầu tư Cổ phiếu Năng động Bảo Việt,Dịch vụ tài chính,OTC,0
1851,BVFMC,Công ty TNHH Quản lý Quỹ Bảo Việt,Dịch vụ thương mại và chuyên nghiệp,Khác,0
1852,BVIM,CTCP Quản lý Quỹ BVIM,Dịch vụ thương mại và chuyên nghiệp,Khác,0
1853,BVMC,CTCP Đầu Tư Bệnh viện Việt Mỹ,,Khác,0
1854,BXBTQuangNinh,Công ty TNHH MTV Bến Xe - Bến Tàu Quảng Ninh,,Khác,0
1855,BXD,CTCP Vận tải và Quản lý Bến xe Đà Nẵng,Vận tải,OTC,"1,736,500"
1856,BXT,CTCP Bến xe Tàu Hậu Giang,Vận tải,OTC,"63,400"
1857,C36,CTCP Quản lý và Xây dựng Công trình Giao thông 236,Hàng hóa công nghiệp,OTC,"1,123,500"
1858,C42,CTCP Xây dựng Thủy lợi 42,,OTC,0
1859,C71,CTCP 471,Hàng hóa công nghiệp,OTC,"5,000,000"
1860,CAA,Công ty TNHH Tư vấn và Kiểm toán CA&A,Dịch vụ thương mại và chuyên nghiệp,Khác,0
1861,CAB,CTCP Tổng Công ty Truyền hình Cáp Việt Nam,Truyền thông và giải trí,OTC,"45,745,876"
1862,CADICO,CTCP Cadico,,OTC,0
1863,Cafatex,CTCP Thủy sản Cafatex,,OTC,0
1864,CafeControl,CTCP Giám định Cà phê và Hàng Hoá Xuất nhập khẩu,,OTC,"1,700,000"
1865,CAGLOBAL,Công ty TNHH Kiểm toán và Tư vấn Toàn cầu,Dịch vụ thương mại và chuyên nghiệp,Khác,0
1866,CAM,CTCP Môi trường đô thị Cà Mau,Tiện ích,OTC,"1,310,700"
1867,CamRanh,CTCP Thương mại Hàng không Cam Ranh,,OTC,0
1868,CangVatCach,CTCP Cảng Vật Cách,,OTC,0
1869,CanHoNamLong,CTCP Phát triển Căn hộ Nam Long,,OTC,0
1870,CanhXuanAudit,Công ty TNHH Kiểm toán Cảnh Xuân,Dịch vụ thương mại và chuyên nghiệp,Khác,0
1871,CaoSuBinhDuong,CTCP Cao su Bình Dương,,OTC,0
1872,CAPHEDALAT,Công ty TNHH MTV Xuất nhập khẩu Cà phê Đà Lạt,,Khác,0
1873,CapitaLand,Công ty TNHH Quản lý Bất động sản CapitalLand,,Khác,0
1874,CapNuocCanTho2,CTCP Cấp nước Cần Thơ II,,OTC,0
1875,CapNuocNghiaLo,Công ty TNHH Xây dựng Cấp thoát nước Nghĩa Lộ,,Khác,0
1876,CapNuocYenBai,Công ty TNHH MTV Cấp nước Yên Bái,,Khác,0
1877,CapQuang,CTCP Công nghệ Cáp quang và Thiết bị Bưu điện,,OTC,0
1878,CapVietNhat,CTCP Đầu tư Thương mại Việt Nhật,,OTC,"10,000,000"
1879,Caric,CTCP Caric,,OTC,0
1880,CASHIN,CTCP Công nghiệp Tàu thủy và Vận tải Cần Thơ,,OTC,"4,732,985"
1881,CASOCO,CTCP Cảng Phú Định,,OTC,0
1882,CathayLife,Công ty TNHH Bảo hiểm Nhân thọ Cathay - Việt Nam,Bảo hiểm,Khác,0
1883,CatTuongAudit,Công ty Kiểm toán Cát Tường VAI,Dịch vụ thương mại và chuyên nghiệp,Khác,0
1884,Cau14,CTCP Cầu 14 - Cienco 1,,OTC,0
1885,CauGiay,CTCP Đầu tư Thương mại Dịch vụ Cầu Giấy,,OTC,"7,670,000"
1886,CauTre,CTCP Thực phẩm CJ Cầu Tre,,OTC,"11,700,000"
1887,CAV,CTCP Dây Cáp điện Việt Nam,Hàng hóa công nghiệp,OTC,"57,600,000"
1888,Cavicob,CTCP Cavico Xây dựng Cầu Hầm,,OTC,"7,000,000"
1889,CavicoEc,CTCP Xây dựng Năng lượng,,OTC,"3,250,000"
1890,CavicoGiaoThong,CTCP CAVICO Giao thông,,OTC,0
1891,CavicoHaTang,CTCP Cavico Xây dựng Hạ tầng,,OTC,0
1892,CavicoHC,CTCP Cavico Xây dựng Thủy điện,,OTC,"6,455,103"
1893,CavicoVN,CTCP Xây dựng và Đầu Tư Cavico Việt Nam,,OTC,0
1894,CayTrong,CTCP Giống cây trồng Quảng Ninh,,OTC,0
1895,CBC,CTCP Chè Bàu Cạn,"Thực phẩm, đồ uống và thuốc lá",OTC,"11,882,400"
1896,CBEC,Công ty TNHH Du lịch sinh thái Cồn Bắp,,Khác,0
1897,CBGC,CTCP Crystal Bay,,Khác,0
1898,CBSC,Công ty TNHH Mặt trời Cát Bà,,Khác,0
1899,CBV,CTCP CTCBIO Việt Nam,,Khác,0
1900,CC4,CTCP Đầu tư và Xây dựng Số 4,Hàng hóa công nghiệp,OTC,"64,000,000"
1901,CC7,CTCP Xây dựng Công trình Giao thông 710,,OTC,"3,167,323"
1902,CCH,CTCP Tư vấn và Đầu tư Xây dựng CCIC Hà Nội,Dịch vụ thương mại và chuyên nghiệp,OTC,"1,000,000"
1903,CCIC,CTCP Đầu tư Con Cưng,,Khác,0
1904,CCN2,CTCP Xây dựng Số 2 Quảng Ninh,,OTC,0
1905,CDMC,CTCP Đường Man,,Khác,0
1906,CE1,CTCP Xây dựng và Thiết bị Công nghiệp CIE1,Hàng hóa công nghiệp,OTC,"6,000,000"
1907,CEC,CTCP Thiết kế Công Nghiệp Hóa chất,Dịch vụ thương mại và chuyên nghiệp,OTC,"5,977,036"
1908,CEE,CTCP Xây dựng Hạ tầng CII,Hàng hóa công nghiệp,OTC,"41,500,000"
1909,CEG,CTCP Tập đoàn Xây dựng và Thiết bị Công nghiệp,Hàng hóa công nghiệp,OTC,"3,800,000"
1910,CemacoHanoi,CTCP Hóa chất và Vật tư Khoa học Kỹ thuật,,OTC,0
1911,CENC,Công ty TNHH Đầu tư Central Capital,,Khác,0
1912,CER,CTCP Địa chính và Tài nguyên Môi trường,Dịch vụ thương mại và chuyên nghiệp,OTC,"1,335,000"
1913,CFC,CTCP Cafico Việt Nam,"Thực phẩm, đồ uống và thuốc lá",OTC,"2,234,280"
1914,CFCC,Công ty xi măng CHINFON,,Khác,0
1915,CGGC,CTCP Đầu tư Thương mại và Dịch vụ Việt Mỹ A&V,,Khác,0
1916,CGL,CTCP Thương mại Gia Lai,Thương mại hàng không thiết yếu,OTC,"1,880,000"
1917,CGP,CTCP Dược phẩm Cần Giờ,"Dược phẩm, công nghệ sinh học và khoa học sự sống",Khác,"10,735,708"
1918,CGRC,CTCP City Garden,,Khác,0
1919,CHAC,CTCP Thương mại Du lịch Đầu tư Cù Lao Chàm,,Khác,0
1920,CHDC,CTCP Hải Đăng,,Khác,0
1921,CheBienLamSan,Công ty Vận tải và Chế biến Lâm sản,,Khác,0
1922,CheBienThucPham,Xí Nghiệp Kinh doanh Gia súc Gia cầm và Chế biến Thực phẩm,,Khác,0
1923,CheLamDong,CTCP Chè Lâm Đồng,,OTC,0
1924,CHIN2,CTCP Chín Chín Núi,,OTC,0
1925,ChipSang,CTCP Chíp Sáng,,OTC,0
1926,ChoLonTourist,CTCP Dịch vụ Du lịch Chợ lớn,,OTC,0
1927,ChuanVang,Công ty TNHH Kiểm toán Chuẩn Vàng,Dịch vụ thương mại và chuyên nghiệp,Khác,0
1928,CHUBBLIFE,Công ty TNHH MTV Quản lý Quỹ CHUBB LIFE,Dịch vụ thương mại và chuyên nghiệp,Khác,0
1929,ChubbLifeVN,Công ty TNHH Bảo hiểm nhân thọ Chubb Việt Nam,Bảo hiểm,Khác,0
1930,CHULAIQN,CTCP Đầu tư và Phát triển Kỳ Hà - Chu Lai Quảng Nam,,OTC,0
1931,CIC,CTCP Đầu tư và Xây dựng Cotec,Hàng hóa công nghiệp,OTC,"4,635,062"
1932,CIC1,CTCP Xây dựng Dân dụng Công nghiệp Số 1 - Đồng Nai,,OTC,"1,537,200"
1933,CIC8,CTCP Đầu tư và Xây dựng Số 8,,OTC,"400,000"
1934,CICP1,CTCP Tư vấn Đầu tư và Xây dựng Công trình 1,,OTC,0
1935,CIE,CTCP Đầu tư và Xây dựng Công trình 128,,OTC,0
1936,CIENCO1,Tổng Công ty Xây dựng Công trình Giao thông 1 - CTCP,,OTC,0
1937,CIENCO473,CTCP 473,,OTC,"2,000,000"
1938,CIENCO5,Tổng Công ty Xây dựng Công trình Giao thông 5 - CTCP,,OTC,0
1939,CIENCO503,CTCP Xây dựng Giao thông 503,,OTC,0
1940,CIENCO610,CTCP Xây dựng Công trình Giao thông 610,,OTC,"2,686,300"
1941,CIENCO624,CTCP Vật tư Thiết bị và Xây dựng Công trình 624,,OTC,0
1942,CIENCO8,Tổng Công ty Xây dựng Công trình Giao thông 8 - CTCP,,Khác,0
1943,Ciencoland,CTCP Đầu tư Xây dựng và Kinh doanh Bất động sản Tổng Sáu,,OTC,0
1944,CIMB,Công ty TNHH Chứng khoán CIMB-VINASHIN,Dịch vụ tài chính,Khác,"33,334,000"
1945,Cistra,CTCP Dịch vụ Thương mại Thành Phố,,OTC,0
1946,CIV,CTCP Đầu tư Vinamotor,,OTC,"3,155,930"
1947,CIVC,CTCP Đầu tư và Phát triển Bất động sản Thế Kỷ,,Khác,0
1948,CJC203,CTCP Xây dựng 203,,OTC,0
1949,CKH,CTCP Cơ khí Chế Tạo Hải Phòng,Hàng hóa công nghiệp,OTC,"1,037,626"
1950,CKI,CTCP Cơ khí ngành In,,OTC,0
1951,CKTAYNINH,CTCP Cơ khí Tây Ninh,,OTC,0
1952,CLAC,Công ty TNHH Đầu tư Cam Lâm,,Khác,0
1953,CLHC,Công ty TNHH Phát triển Bất động sản Cát Liên Hoa,,Khác,0
1954,CLP,CTCP Thủy sản Cửu Long,"Thực phẩm, đồ uống và thuốc lá",OTC,"8,000,000"
1955,CLRC,CTCP Đầu Tư Công nghệ Smarttech,,Khác,0
1956,CLS,CTCP Chứng khoán Chợ Lớn,Dịch vụ tài chính,Khác,0
1957,CLWC,CTCP Phong điện Chơ Long,,Khác,0
1958,CMCHanoi,CTCP Vật liệu Xây dựng Hà Nội,,OTC,0
1959,CMHC,CTCP Cổng Mây,,Khác,0
1960,CMIBBank,Ngân hàng TNHH MTV CIMB Việt Nam,,Khác,0
1961,CNCC,CTCP Thương mại - Dịch vụ Công nghệ cao,,Khác,0
1962,CNH,CTCP Cảng Nha Trang,Vận tải,OTC,"24,539,049"
1963,CNTC,CTCP Công nghiệp Năng lượng Ninh Thuận,,Khác,0
1964,CO122,CTCP Xây dựng và Đầu tư 122 - Cienco 1,,OTC,0
1965,CoKhiDuyenHai,Công ty TNHH Nhà nước MTV Cơ khí Duyên Hải,,Khác,0
1966,CoKhiHonGai,CTCP Cơ khí Hòn Gai - Vinacomin,,OTC,0
1967,CokhiNgoGiaTu,CTCP Cơ khí Ngô Gia Tự,,OTC,0
1968,CoKhiOTo32,CTCP Cơ khí Ô Tô 3-2,,OTC,0
1969,Colombo,Công ty TNHH Đầu tư và Phát triển Colombo,,Khác,0
1970,COMPT,"Công ty TNHH Tư vấn Đầu tư, Tài chính, Kế toán Thuế - Kiểm toán COM.PT",Dịch vụ thương mại và chuyên nghiệp,Khác,0
1971,ConDao,CTCP Thủy sản và Xuất nhập khẩu Côn Đảo,,OTC,0
1972,CongNgheCao,CTCP Công nghệ Cao,,OTC,0
1973,CongNghiepMasan,CTCP Công nghiệp Masan,,OTC,0
1974,CongNghiepPhuYen,CTCP Công nghiệp Phú Yên,,OTC,0
1975,CongThanh,CTCP Xi măng Công Thanh,,OTC,0
1976,CongTrinh134,CTCP Đầu tư và Xây dựng Công trình 134,,OTC,0
1977,CongTrinh525,CTCP Xây dựng Công trình 525,,OTC,"3,130,000"
1978,CongTrinhBuuDien,CTCP Phát triển Công trình Bưu điện,,OTC,0
1979,CongTrinhGTDB,CTCP Công trình Giao thông Tỉnh Điện Biên,,OTC,0
1980,CongTrinhHaNoi,CTCP Đầu Tư Công trình Hà Nội,,OTC,0
1981,CongTy118,CTCP 118,,OTC,0
1982,CONSTRAD423,CTCP Xây dựng và Thương mại 423,,OTC,"1,250,000"
1983,CoopBank,Ngân hàng Hợp tác xã Việt Nam,Tổ chức tín dụng,Khác,0
1984,COPAC,CTCP Đầu Tư Xây dựng và Thương mại Thái Bình Dương,,OTC,"9,700,000"
1985,Coresco,CTCP Đầu Tư Xây dựng Kinh doanh Nhà Bến Thành,,OTC,"2,600,000"
1986,Cosaco,CTCP Sài Gòn Xây dựng,,OTC,0
1987,Cosevco1,CTCP Sản xuất Vật liệu và Xây dựng Cosevco 1,,OTC,0
1988,Cosevco75,CTCP Cosevco 75,,OTC,0
1989,COT60,CTCP Công trình Giao thông 60,,OTC,0
1990,Cotec,CTCP Kỹ thuật Xây dựng và Vật liệu Xây dựng COTEC,,OTC,0
1991,CotecAnpha,CTCP Kỹ thuật Xây dựng Anpha,,OTC,0
1992,COXANO,CTCP Cơ khí Xây dựng Công trình Thừa Thiên Huế,,OTC,"1,556,240"
1993,CPAHaNoi,Công ty Kiểm toán và Kế toán Hà Nội,Dịch vụ thương mại và chuyên nghiệp,Khác,0
1994,CPAHCM,Công ty TNHH Kiểm toán và Tư vấn CPA HCM,Dịch vụ thương mại và chuyên nghiệp,Khác,0
1995,CPAVietNam,Công ty Hợp danh Kiểm toán Việt Nam,Dịch vụ thương mại và chuyên nghiệp,Khác,0
1996,CPGC,CTCP Tập đoàn Casper Việt Nam,,Khác,0
1997,CPHACO,CTCP Đầu tư Xây dựng Chánh Phú Hòa,,Khác,0
1998,CPLC,Công ty TNHH Capitaland Tower,,Khác,0
1999,CPSC,Công ty TNHH Mặt trời Cẩm Phả,,Khác,0
2000,CPT,CTCP Xây lắp Bưu điện,,OTC,0
2001,CPTC,CTCP Đầu Tư và Xây dựng Giao thông Vận tải,,Khác,0
2002,CPW,CTCP Công trình Giao thông Công chánh,Hàng hóa công nghiệp,OTC,"26,875,000"
2003,CQNC,CTCP Capella Quảng Nam,,Khác,0
2004,CRV,CTCP Tập đoàn Bất động sản CRV,,Khác,0
2005,CSCJ,CTCP Chứng khoán Thủ Đô,Dịch vụ tài chính,OTC,"7,573,667"
2006,CSG,CTCP Cáp Sài Gòn,Dịch vụ viễn thông,Khác,"29,742,020"
2007,CSLC,CTCP Hải Phát Retail,,Khác,0
2008,CST124,CTCP Xây dựng Giao thông và Thương mại 124,,OTC,0
2009,CT185,CTCP Trường Sơn 185,,Khác,0
2010,CT5,CTCP 319.5,Hàng hóa công nghiệp,OTC,"4,400,000"
2011,CTAC,CTCP Du lịch và Đầu Tư Xây dựng Châu Á,,Khác,0
2012,CTC,CTCP Tập đoàn Hoàng Kim Tây Nguyên,Dịch vụ tiêu dùng,OTC,"15,799,926"
2013,CTCCorp,CTCP Đô thị Du lịch Cần Giờ,,OTC,0
2014,CTE,CTCP Hạ Tầng Viễn Thông CMC,,OTC,0
2015,CTEC,CTCP Xây dựng và Trang trí Nội thất Cát Tường,,Khác,0
2016,CTGT,CTCP Công trình Giao thông Tỉnh Bà Rịa - Vũng Tàu,,OTC,"6,000,000"
2017,CTLC,Công ty TNHH CITYLAB,,Khác,0
2018,CTM,CTCP Đầu tư Xây dựng và Khai thác mỏ Vinavico,Hàng hóa công nghiệp,OTC,"4,399,996"
2019,CTRC,Công ty TNHH Đầu tư Cao su Cường Thịnh,,Khác,0
2020,CTV,CTCP Đầu tư - Sản xuất và Thương mại Việt Nam,Thương mại hàng không thiết yếu,OTC,"2,000,000"
2021,CTVC,Tập đoàn Cá tầm Việt Nam,,Khác,0
2022,Cty479,CTCP 479,,OTC,0
2023,CTYCN2,Công ty TNHH MTV Cấp nước số 2,,Khác,0
2024,CVC,CTCP Cơ điện Vật tư,Hàng hóa công nghiệp,OTC,"2,200,000"
2025,CVDC,CTCP Đầu tư và Phát triển Du lịch Vân Đồn,,Khác,0
2026,CVH,"CTCP Công viên, Cây xanh Hải Phòng",Dịch vụ thương mại và chuyên nghiệp,OTC,"1,280,000"
2027,CVP,CTCP Cảng Cửa Việt,Vận tải,OTC,"3,425,980"
2028,CVS,CTCP Chứng khoán CV,Dịch vụ tài chính,OTC,0
2029,CVSC,CTCP CVS Holding,,Khác,0
2030,CXC,CTCP Cầu Xây,,OTC,0
2031,CXH,CTCP Xe khách Hà Nội,Vận tải,OTC,"1,885,306"
2032,CZC,CTCP Than Miền Trung,Năng lượng,OTC,"5,602,590"
2033,D17,CTCP Đồng Tân,Nguyên vật liệu,OTC,"5,259,700"
2034,D26,CTCP Quản lý và Xây dựng Đường bộ 26,Hàng hóa công nghiệp,OTC,"1,000,000"
2035,DAB,Ngân hàng TMCP Đại Á,Tổ chức tín dụng,Khác,"310,000,000"
2036,DaBinhDinh,CTCP VRG Đá Bình Định,,OTC,0
2037,DAFC,CTCP Thời trang và Mỹ phẩm Duy Anh,,Khác,0
2038,DaGiayHaiPhong,CTCP Da Giầy và Phát triển Hải Phòng,,OTC,0
2039,DaGiayVietNam,CTCP Da Giầy Việt Nam,,OTC,0
2040,DaichiLife,Công ty TNHH Bảo hiểm Nhân thọ Dai-ichi Việt Nam,Bảo hiểm,Khác,0
2041,DaiMo,CTCP Cơ khí Xây dựng Đại Mỗ,,OTC,0
2042,DaiNam,Văn Phòng Thám Tử Điều Tra - Theo Dõi Đại Nam,,Khác,0
2043,DaiNamAudit,Công ty TNHH Kiểm toán và Giải pháp Công nghệ Thông tin Đại Nam,Dịch vụ thương mại và chuyên nghiệp,Khác,0
2044,DaiTinAudit,Công ty TNHH Kiểm toán Đại Tín,Dịch vụ thương mại và chuyên nghiệp,Khác,0
2045,DAKC,Công ty Liên doanh TNHH Phát triển Đô thị mới An Khánh,,Khác,0
2046,DALC,Công ty TNHH Đầu tư và Phát triển Bất động sản Đại Hùng,,Khác,0
2047,DaNangXD,CTCP Xây dựng Công trình Giao thông Đà Nẵng,,OTC,0
2048,DANATEX,CTCP Dệt Hòa Khánh - Đà Nẵng,,OTC,0
2049,DAP,CTCP Đông Á,Nguyên vật liệu,OTC,"1,680,000"
2050,DAR,CTCP Xe lửa Dĩ An,Dịch vụ thương mại và chuyên nghiệp,OTC,"6,500,000"
2051,DaTayDo,CTCP Da Tây Đô,,OTC,0
2052,DATC,Công ty TNHH Mua Bán Nợ Việt Nam,,Khác,0
2053,DatVang,CTCP Sông Đà - Đất Vàng,,OTC,0
2054,DauTuHaNoi,CTCP Thương mại và Đầu tư TIC Hà Nội,,OTC,0
2055,DBCC,Tổng công ty Đông Bắc - Bộ Quốc Phòng,,Khác,0
2056,DBF,CTCP Lương thực Đông Bắc,Thương mại hàng thiết yếu,OTC,"3,679,200"
2057,DBH,CTCP Đường bộ Hải Phòng,Hàng hóa công nghiệp,OTC,"2,200,000"
2058,DBIC,Công ty TNHH MTV Đầu tư và Phát triển DB,,Khác,0
2059,DBJC,CTCP Điện Biên,,Khác,0
2060,DBW,CTCP Cấp nước Điện Biên,Tiện ích,OTC,"39,320,100"
2061,DCAC,CTCP Tập đoàn Đèo Cả,,Khác,0
2062,DCC,CTCP Xây dựng Công nghiệp (DESCON),Hàng hóa công nghiệp,OTC,"10,300,000"
2063,DCCC,CTCP Địa Cầu,,Khác,0
2064,DCD,CTCP Du lịch và Thương mại DIC,Dịch vụ tiêu dùng,Khác,"11,294,323"
2065,DCHY,Công ty TNHH Đầu tư Dream City Villas Hưng Yên,,Khác,0
2066,DCI,CTCP Công nghiệp Hóa chất Đà Nẵng,Nguyên vật liệu,OTC,"2,412,518"
2067,DCPA,Công ty TNHH Tư vấn DCPA,Dịch vụ thương mại và chuyên nghiệp,Khác,0
2068,DCTC,Công ty TNHH DCT Partners Việt Nam,,Khác,0
2069,DDCC,CTCP Đầu tư Bất động sản Đông Dương,,Khác,0
2070,Deloitte,Công ty TNHH Deloitte Việt Nam,Dịch vụ thương mại và chuyên nghiệp,Khác,0
2071,DeltaAgf,CTCP Đầu tư và Xây dựng Delta AGF,,OTC,"5,691,644"
2072,DeltaCorp,CTCP Đầu tư Châu Thổ,,OTC,0
2073,DeltaTower,CTCP Cảnh Hưng Hải Thành,,OTC,"24,000,000"
2074,DetHaDong,CTCP Dệt Hà Đông,,OTC,"1,300,000"
2075,DetPhongPhu,CTCP Dệt vải Phong Phú,,OTC,0
2076,DetVinhPhu,CTCP Dệt Vĩnh Phú,,OTC,0
2077,DeutscheBank,Ngân hàng Deutsche Việt Nam,Tổ chức tín dụng,Khác,0
2078,DFK,Công ty TNHH Kiểm toán DFK Việt Nam,Dịch vụ thương mại và chuyên nghiệp,Khác,0
2079,DFS,CTCP Chế biến Xuất nhập khẩu Nông sản Thực phẩm Đồng Nai,"Thực phẩm, đồ uống và thuốc lá",OTC,"22,500,000"
2080,DFVN,Công ty TNHH MTV Quản lý Quỹ Dai-Ichi Life Việt Nam,Dịch vụ thương mại và chuyên nghiệp,Khác,0
2081,DGL,CTCP Hóa chất Đức Giang - Lào Cai,Nguyên vật liệu,Khác,"99,785,463"
2082,DHAC,Công ty TNHH MTV Đầu tư DHA,,Khác,0
2083,DHCC,CTCP Thủy điện Đakđrinh,,Khác,0
2084,DHI,CTCP In Diên Hồng,Dịch vụ thương mại và chuyên nghiệp,Khác,"2,628,042"
2085,DHL,CTCP Cơ khí Vận tải Thương mại Đại Hưng,Nguyên vật liệu,Khác,"5,500,000"
2086,DIAOC3,CTCP Xây dựng và Kinh doanh Địa Ốc III,,OTC,0
2087,DIAOC8,CTCP Địa ốc 8,,Khác,0
2088,DiaOcGiaDinh,CTCP Đầu tư Địa ốc Gia Định,,OTC,0
2089,DiaOcXanh,Công ty TNHH Đầu tư Kinh doanh và Phát triển Thương mại Địa Ốc Xanh,,Khác,0
2090,DIC1,CTCP Xây dựng Đô thị và Khu công nghiệp,,OTC,"2,000,000"
2091,DICC,Công ty TNHH Dynamic Innovation,,Khác,0
2092,DICThanhBinh,CTCP Đầu tư Phát triển Xây dựng Thanh Bình,,OTC,"500,000"
2093,DienLucDaNang,CTCP Thủy điện Điện Lực Đà Nẵng,,OTC,0
2094,DienNuocHaNoi,CTCP Xây dựng Lắp máy Điện nước Hà Nội,,OTC,0
2095,DienThuBon,CTCP Thủy điện Thu Bồn,,OTC,0
2096,Diginet,CTCP Định Gia Nét,,OTC,"1,500,000"
2097,DinhThien,Công Ty TNHH Thương mại Dịch vụ Kỹ thuật Đỉnh Thiên,,Khác,0
2098,DJCC,CTCP Thủy điện Đakrông,,Khác,0
2099,DKDC,Công ty TNHH Du lịch Khách sạn Đông Á,,Khác,0
2100,DKH,Trung tâm Đăng kiểm phương tiện Giao thông Thủy bộ,Dịch vụ thương mại và chuyên nghiệp,OTC,"212,036"
2101,DKHC,CTCP Đầu tư Danh khôi Holdings,,Khác,0
2102,DKKC,CTCP Tập đoàn Dekko,,Khác,0
2103,DKP,CTCP Dược Khoa,"Dược phẩm, công nghệ sinh học và khoa học sự sống",OTC,"3,003,910"
2104,DKSC,CTCP Đầu tư Bất động sản Danh Khôi Sài Gòn,,Khác,0
2105,DLAC,CTCP Đầu tư và Xây dựng Kiên Trung,,Khác,0
2106,DLBD,CTCP Du lịch Bưu điện,,OTC,0
2107,DLC,CTCP Du lịch Cần Thơ,Dịch vụ tiêu dùng,OTC,"4,780,080"
2108,DLCC,Công ty TNHH Đầu tư và Phát triển Đô thị Đắk Lắk,,Khác,0
